"NIODebugger: A Novel Approach to Repair Non-Idempotent-Outcome Tests with LLM-Based Agent","K. Ke","University of Illinois Urbana-Champaign, Urbana, IL, USA",2025 IEEE/ACM 47th International Conference on Software Engineering (ICSE),"23 Jun 2025","2025","","","1014","1025","Flaky tests, characterized by inconsistent results across repeated executions, present significant challenges in software testing, especially during regression testing. Recently, there has been emerging research interest in non-idempotentoutcome (NIO) flaky tests-tests that pass on the initial run but fail on subsequent executions within the same environment. Despite progress in utilizing Large Language Models (LLMs) to address flaky tests, existing methods have not tackled NIO flaky tests. The limited context window of LLMs restricts their ability to incorporate relevant source code beyond the test method itself, often overlooking crucial information needed to address state pollution, which is the root cause of NIO flakiness. This paper introduces NIODebugger, the first framework to utilize an LLM-based agent to repair flaky tests. NIODebugger features a three-phase design: detection, exploration, and fixing. In the detection phase, dynamic analysis collects stack traces and custom test execution logs from multiple test runs, which helps in understanding accumulative state pollution. During the exploration phase, the LLM-based agent provides instructions for extracting relevant source code associated with test flakiness. In the fixing phase, NIODebugger repairs the tests using the information gathered from the previous phases. NIODebugger can be integrated with multiple LLMs, achieving patching success rates ranging from 11.63% to 58.72%. Its best-performing variant, NIODebugger-GPT-4, successfully generated correct patches for 101 out of 172 previously unknown NIO tests across 20 largescale open-source projects. We submitted pull requests for all generated patches; 58 have been merged, only 1 was rejected, and the remaining 42 are pending. The Java implementation of NIODebugger is provided as a Maven plugin accessible at https://github.com/kaiyaok2/NIOInspector.","1558-1225","979-8-3315-0569-1","10.1109/ICSE55347.2025.00226","","https://ieeexplore.ieee.org/stamp/stamp.jsp?arnumber=11029812","flaky tests;llm-based agent;software testing","Software testing;Java;Pollution;Source coding;Large language models;Maintenance engineering;Feature extraction;Distance measurement;Software engineering","","1","","58","IEEE","23 Jun 2025","26 April-6 May 2025","26 April-6 May 2025","IEEE","IEEE Conferences"
"Lockheed Martin AI Factory: Generative AI and MLOps for Engineering, Enterprise and Edge","M. Maybury; G. Forrest; D. O'Donnell","Technology and Strategic Innovation Lockheed Martin, Chelmsford, MA, USA; AI Foundations Lockheed Martin AI Center, Shelton, CT, USA; Astris AI, Westport, CT, USA",2025 IEEE International Conference on AI and Data Analytics (ICAD),"20 Aug 2025","2025","","","1","7","This article reports on the rapid creation and deployment at scale of hundreds of Large Language Model (LLM) applications, highlighting several across enterprise, engineering and edge use cases. This outcome was accelerated by the creation of an open architecture, secure and scalable generative AI Factory. An extensible platform, AI Factory empowers thousands of developers and over 50,000 end users across a diverse set of data types and use cases throughout our global enterprise. This evolvable approach reveals how to affordably deploy generative AI to create value securely at scale.","","979-8-3315-2472-2","10.1109/ICAD65464.2025.11114065","","https://ieeexplore.ieee.org/stamp/stamp.jsp?arnumber=11114065","Generative AI;AI Factory;LLMs;scale;security","Data analysis;Generative AI;Large language models;Production facilities;Security","","","","20","IEEE","20 Aug 2025","24-24 June 2025","24-24 June 2025","IEEE","IEEE Conferences"
"AI-Powered Multi-Agent Framework for Automated Unit Test Case Generation: Enhancing Software Quality through LLM’s","A. Garlapati; M. N. V. Satya Sai Muni Parmesh; Savitha; J. S","Watsonx Client Engineering, IBM, Bangalore; Watsonx Client Engineering, IBM, Bangalore; Watsonx Client Engineering, IBM, Bangalore; Watsonx Client Engineering, IBM, Bangalore",2024 5th IEEE Global Conference for Advancement in Technology (GCAT),"20 Mar 2025","2024","","","1","5","Recent years have witnessed an enormous rise in the design, repair and the enhancement of software automation tests. The reliability of program’s unit testing has major impact on its overall performance. The anticipated influence of Artificial Intelligence advancements on test automation methodologies are significant. Many studies on automated testing implicitly assume that the test results are deterministic, means that similar tests faults remain same. The precision of software is largely ensured by unit testing. But writing unit tests manually is a time-consuming process, which leads us to drive into ""Automation Analysis"". Recent years comprised the application of Large Language Models (LLM’s) in numerous fields related to software development, especially the automated creation of unit testing.However, these frameworks require more instructions, or few shot learnings on sample tests that already exist. This research provides a comprehensive empirical assessment of the efficiency of LLM’s for automating unit testing production, with no need for further manual analysis. The method we employ is put into practice for test cases, an adaptable Agents and LLM-based testing framework that evaluates test cases generated, by reviewing and re-writing them in different phases. Evaluation of this test cases was done by using mistral-large LLM Model. The analysis results that developed acquired an overall coverage of 100% for code given. Finally, to enhance the typical evaluation, this research suggests and concludes that LLMs, can be successfully incorporated into present practices, through adaptative instructions and improvements.","","979-8-3503-7668-5","10.1109/GCAT62922.2024.10923987","","https://ieeexplore.ieee.org/stamp/stamp.jsp?arnumber=10923987","Large Language Models - LLM’s;Manual Testing;Artificial Intelligence;Automation;Agents;Unit Tests","Java;Codes;Automation;Large language models;Manuals;Switches;Writing;Software reliability;Standards;Testing","","4","","15","IEEE","20 Mar 2025","4-6 Oct. 2024","4-6 Oct. 2024","IEEE","IEEE Conferences"
"IntelliTest: An Intelligent Framework for Agentic Functional Test Generation Using Multimodal Data and Domain Knowledge","A. S. Tiwari; S. Ganesh Nutan Dev C; P. M. Patole; G. Ponnamreddy; S. Chinthalapudi; D. P. Kattamanchi","Samsung Semiconductor India Research, Bangalore, India; Samsung Semiconductor India Research, Bangalore, India; Samsung Semiconductor India Research, Bangalore, India; Samsung Semiconductor India Research, Bangalore, India; Samsung Semiconductor India Research, Bangalore, India; Samsung Semiconductor India Research, Bangalore, India",2025 IEEE Future Networks World Forum (FNWF),"2 Jan 2026","2025","","","1","6","IntelliTest is an end-to-end, locally deployable framework that automates functional test generation and selection for complex embedded systems from two input modes: Software Change Artifacts (SCAs)—multimodal changelist data combining code diffs with textual metadata—and Natural-Language Queries (NLQs) for direct test requests. It employs a domainagnostic ontology defining procedural semantics, compiled into a structured procedural database and a specification knowledge graph for retrieval-augmented reasoning. The dual-agent architecture—Context-Analysis-and-Scoping Agent (CASA) and Constrained-Testcase-Synthesis Agent (CTSA)—interprets SCAs or NLQs, validates functionalities through ontology-grounded databases, and synthesizes constraint-compliant sequences. Dynamic coverage databases use greedy set-cover selection and cross-impact expansion to expose cousin bugs in adjacent modules. Human-in-the-loop feedback refines ontology instantiations. Deployed locally for data-security compliance, IntelliTest was validated on commercial modem firmware (>50,000 files, >250,000 functions), achieving 95% functionality identification, 92% code-change coverage, 90% constraint satisfaction, and a five-fold reduction in generation time, shrinking regression suites by 40–60% while maintaining comprehensive coverage","2770-7679","979-8-3315-9193-9","10.1109/FNWF66845.2025.11317278","","https://ieeexplore.ieee.org/stamp/stamp.jsp?arnumber=11317278","Automated Functional Testing;LLM Agents;multi-agent systems;ontology-driven generation;dual-agent frameworks;retrieval-augmented generation","Accuracy;Databases;Semantics;Knowledge graphs;Ontologies;Modems;Software;Test pattern generators;Microprogramming;Testing","","","","16","IEEE","2 Jan 2026","10-12 Nov. 2025","10-12 Nov. 2025","IEEE","IEEE Conferences"
"Multi-Agent Auditing for Smart Contracts*","Y. Ding; J. Yu; A. Twabi; L. Zhang; T. Kondo; H. Sato","Hiroshima University, Higashihiroshima, Japan; The University of Tokyo, Tokyo, Japan; Hiroshima University, Higashihiroshima, Japan; The University of Tokyo, Tokyo, Japan; Hiroshima University, Higashihiroshima, Japan; National Institute of Informatics, Tokyo, Japan",2025 9th International Symposium on Computer Science and Intelligent Control (ISCSIC),"26 Jan 2026","2025","","","1","7","Smart contracts underpin contemporary decentralized systems, yet their immutability and perpetual execution amplify the consequences of latent defects. Despite progress in manual audits, static analysis, fuzzing, and formal verification, auditors face a widening gap between the scalability and desired assurance due to limited automation capability. Recent large language models (LLMs) with tool-use capabilities promise greater automation, but monolithic single-agent auditors struggle with coverage, robustness, and reproducibility. Motivated by addressing these issues, we propose Multi-Agent Auditing (MAA), a framework that coordinates a team of tool-grounded agents through a constrained protocol that privileges verifiable artifacts. Besides, we mechanize an LLM-assisted orchestration mechanism and a shared knowledge base to coordinate a set of agents specialized in sophisticated testing approaches to produce budget-aware and evidence-centric audit results. Furthermore, we present the experiment results showing that MAA outperforms singleLLM auditors and provide empirical insights into LLM-backend selection.","","979-8-3315-6593-0","10.1109/ISCSIC67494.2025.11352002","","https://ieeexplore.ieee.org/stamp/stamp.jsp?arnumber=11352002","multi-agent system;smart contract;large language model;agent orchestration;software testing","Automation;Large language models;Scalability;Smart contracts;Knowledge based systems;Static analysis;Manuals;Robustness;Reproducibility of results;Multi-agent systems","","","","32","IEEE","26 Jan 2026","26-28 Sept. 2025","26-28 Sept. 2025","IEEE","IEEE Conferences"
"An Agentic Reasoning-Based Feedback System for Programming Assignments","N. A. A. Sulaiman; H. Haron; N. M. Mahfuz; N. A. M. Saat; S. N. Daud; S. Alias","Sustainable Information Technology & Innovation Center, Faculty of Engineering, Built Environment and Information Technology (FOEBEIT), SEGi University, Selangor, Malaysia; Sustainable Information Technology & Innovation Center, Faculty of Engineering, Built Environment and Information Technology (FOEBEIT), SEGi University, Selangor, Malaysia; Sustainable Information Technology & Innovation Center, Faculty of Engineering, Built Environment and Information Technology (FOEBEIT), SEGi University, Selangor, Malaysia; Sustainable Information Technology & Innovation Center, Faculty of Engineering, Built Environment and Information Technology (FOEBEIT), SEGi University, Selangor, Malaysia; Centre for Network Security and IoT, Faculty of Engineering, Built Environment and Information Technology (FOEBEIT), SEGi University, Selangor, Malaysia; Centre for Network Security and IoT, Faculty of Engineering, Built Environment and Information Technology (FOEBEIT), SEGi University, Selangor, Malaysia","2025 IEEE 11th International Conference on Computing, Engineering and Design (ICCED)","13 Jan 2026","2025","","","1","6","This study introduces Explain-then-Grade, an automated feedback framework designed for programming lab assignments using agent reasoning and large language models (LLMs). Unlike conventional auto-graders, which provide marks directly and general feedback, the proposed framework requires the agent to explain detected errors prior to assigning marks, thereby enhancing pedagogical value and transparency. The framework integrates sandboxed execution, on-the-fly test generation, and structured, stepwise explanatory reasoning, ensuring that students receive constructive, rubric-aligned feedback. To evaluate its effectiveness, the system was applied to anonymized submissions from a Data Mining module and complemented with open-source student code repositories. Performance was benchmarked against classic unit test-based auto-graders and LLM-only grading models, using five dimensions: grading accuracy, explanation quality, error coverage, and efficiency. Results demonstrate that Explain-then-Grade achieved higher grading reliability ($93 \%$ accuracy, $\kappa=0.85$), superior explanation quality (4.4/5), broader error coverage ($83.7 \%$), and substantial time savings ($67 \%$). These outcomes highlight its potential to support both traditional and open and distance learning (ODL) contexts by shifting automated assessment from mere evaluation toward formative, feedback-driven learning. The study establishes a structured agentic reasoning pipeline for reproducible and pedagogically aligned automated grading.","2767-7826","979-8-3315-4520-8","10.1109/ICCED68324.2025.11324743","","https://ieeexplore.ieee.org/stamp/stamp.jsp?arnumber=11324743","Agent Reasoning;Automated Grading;Large Language Model (LLM);Trustworthy AI in Education","Computer aided instruction;Accuracy;Codes;Large language models;Pipelines;Cognition;Test pattern generators;Reliability;Data mining;Programming profession","","","","16","IEEE","13 Jan 2026","13-15 Nov. 2025","13-15 Nov. 2025","IEEE","IEEE Conferences"
"Multi-Agent Fuzzy Reinforcement Learning With LLM for Cooperative Navigation of Endovascular Robotics","T. Yao; Y. Xu; H. Wang; X. Qiu; K. Althoefer; P. Qi","Department of Control Science and Engineering, College of Electronic and Information Engineering, Shanghai Institute of Intelligent Science and Technology, Tongji University, Shanghai, China; College of Engineering, Southern University of Science and Technology, Shenzhen, China; Department of Control Science and Engineering, College of Electronic and Information Engineering, Shanghai Institute of Intelligent Science and Technology, Tongji University, Shanghai, China; School of Electronic and Electrical Engineering, Shanghai University of Engineering Science, Shanghai, China; Centre for Advanced Robotics @ Queen Mary, School of Engineering and Materials Science, Queen Mary University of London, London, U.K.; Department of Control Science and Engineering, College of Electronic and Information Engineering, Shanghai Institute of Intelligent Science and Technology, Tongji University, Shanghai, China",IEEE Transactions on Fuzzy Systems,"","2025","PP","99","1","11","Endovascular interventions require precise, cooperative control of multiple instruments, such as guidewires and catheters, to navigate complex vascular anatomies. Current robotic systems, reliant on leader-follower control, depend heavily on operator expertise and lack intelligence. Learning-based methods, often limited to single-instrument control, fall short in complex clinical scenarios requiring multi-instrument coordination. This study proposes a Multi-Agent Fuzzy Reinforcement Learning (MAFRL) framework, guided by large language models (LLMs), for task-level autonomous, cooperative navigation in endovascular robotics. LLMs provide procedural priors and context-aware policy guidance, enabling adaptive decision-making for collaborative guidewire and catheter agents. Central to the framework, fuzzy reinforcement learning mitigates LLM-induced uncertainties by adaptively embedding clinical constraints into reward functions, ensuring strict adherence to procedural safety and precise alignment with the complexities of real-world endovascular interventions. Validated in a 3D vascular simulation, this approach achieves superior navigation performance and procedural efficiency compared to conventional methods, underscoring the transformative potential of fuzzy reinforcement learning in advancing LLM-guided MARL for endovascular robotics.","1941-0034","","10.1109/TFUZZ.2025.3585934","National Key Research and Development Program of China(grant numbers:2023YFB4705200); National Natural Science Foundation of China(grant numbers:62273257); Open Project Fund of State Key Laboratory of Cardiovascular Diseases(grant numbers:2024SKL-TJ002); ","https://ieeexplore.ieee.org/stamp/stamp.jsp?arnumber=11078928","Autonomous navigation;endovascular procedure;fuzzy reinforcement learning;large language models;learning-based control","Navigation;Catheters;Robots;Robot kinematics;Reinforcement learning;Fuzzy systems;Uncertainty;Instruments;Decision making;Anatomy","","5","","","IEEE","14 Jul 2025","","","IEEE","IEEE Early Access Articles"
"Agent for User: Testing Multi - User Interactive Features in TikTok","S. Feng; C. Du; H. Liu; Q. Wang; Z. Lv; G. Huo; X. Yang; C. Chen","Monash University, Australia; Jilin University, China; Jilin University, China; Jilin University, China; Bytedance, China; Bytedance, China; Bytedance, China; Technical University of Munich, Germany",2025 IEEE/ACM 47th International Conference on Software Engineering: Software Engineering in Practice (ICSE-SEIP),"20 Aug 2025","2025","","","57","68","TikTok, a widely-used social media app boasting over a billion monthly active users, requires effective app quality assurance for its intricate features. Feature testing is crucial in achieving this goal. However, the multi-user interactive features within the app, such as live streaming, voice calls, etc., pose significant challenges for developers, who must handle simultaneous device management and user interaction coordination. To address this, we introduce a novel multi-agent approach, powered by the Large Language Models (LLMs), to automate the testing of multi-user interactive app features. In detail, we build a virtual device farm that allocates the necessary number of devices for a given multi-user interactive task. For each device, we deploy an LLM-based agent that simulates a user, thereby mimicking user interactions to collaboratively automate the testing process. The evaluations on 24 multi-user interactive tasks within the TikTok app, showcase its capability to cover 75% of tasks with 85.9 % action similarity and offer 87 % time savings for developers. Additionally, we have also integrated our approach into the real-world TikTok testing platform, aiding in the detection of 26 multi-user interactive bugs.","2832-7659","979-8-3315-3685-5","10.1109/ICSE-SEIP66354.2025.00011","","https://ieeexplore.ieee.org/stamp/stamp.jsp?arnumber=11121721","multi-agent LLMs;multi-user interactive feature;android app testing","Software testing;Video on demand;Social networking (online);Computer bugs;Software;Web sites;Time factors;Servers;Testing;Software engineering","","","","59","IEEE","20 Aug 2025","27 April-3 May 2025","27 April-3 May 2025","IEEE","IEEE Conferences"
"Try-Then-Eval: Equipping an LLM-based Agent with a Two-Phase Mechanism to Solve Computer Tasks","D. Cao; P. Nguyen; V. Le; L. Nguyen; V. Nguyen","Faculty of Information Technology, University of Science, Ho Chi Minh City, Vietnam; Faculty of Information Technology, University of Science, Ho Chi Minh City, Vietnam; Faculty of Computer Science, University of Information Technology, Ho Chi Minh City, Vietnam; Faculty of Information Technology, University of Science, Ho Chi Minh City, Vietnam; Faculty of Information Technology, University of Science, Ho Chi Minh City, Vietnam","2024 IEEE International Conference on Systems, Man, and Cybernetics (SMC)","20 Jan 2025","2024","","","1224","1229","Building an autonomous intelligent agent capable of carrying out web automation tasks from descriptions in natural language offers a wide range of applications, including software testing, virtual assistants, and task automation in general. However, recent studies addressing this problem often require manually constructing of prior human demonstrations. In this paper, we approach the problem by leveraging the idea of reinforcement learning (RL) with the two-phase mechanism to form an agent using LLMs for automating computer tasks without relying on human demonstrations. We evaluate our LLM-based agent using the MiniWob++ dataset of web-based application tasks, showing that our approach achieves 85% success rate without prior demonstrations. The results also demonstrate the agent's capability of self-improvement through training.","","978-1-6654-1020-5","10.1109/SMC54092.2024.10831260","","https://ieeexplore.ieee.org/stamp/stamp.jsp?arnumber=10831260","","Training;Software testing;Automation;Virtual assistants;Supervised learning;Natural languages;Reinforcement learning;Planning;Intelligent agents;Cybernetics","","","","25","IEEE","20 Jan 2025","6-10 Oct. 2024","6-10 Oct. 2024","IEEE","IEEE Conferences"
"LLMs in Debate: Does Arguing Make Them Better at Detecting Metamorphic Relations?","D. B. Bose; Y. B. Alebachew; C. Brown","Department of Computer Science, Virginia Tech; Department of Computer Science, Virginia Tech; Department of Computer Science, Virginia Tech",2025 40th IEEE/ACM International Conference on Automated Software Engineering Workshops (ASEW),"19 Jan 2026","2025","","","43","50","Large Language Models (LLMs) are transforming software engineering, including mobile Augmented Reality (AR) applications. AR software behavior often depends on dynamic environmental factors, making it difficult to use conventional testing and verification approaches. Metamorphic Testing (MT) offers an alternative by assessing whether expected transformations hold across varied conditions. However, there is limited work exploring how well LLMs can detect these transformations-Metamorphic Relations (MRs)-in applications. We propose a stability-driven evaluation framework that examines whether LLMs consistently apply MRs across rephrasings. Our study finds that StarCoder and CodeLlama exhibit higher stability in MR identification compared to the general-purpose model Gemma. Additionally, we use a multi-agent debate framework to investigate whether combining multiple perspectives improves consistency in MR identification. The debate mechanism reduces MR inconsistencies, leading to more stable MR identification across all MRs. While debate helps stabilize MR identification, our evaluation against humanlabeled ground truth reveals that stability alone does not always correlate with correctness. Some models maintain stable yet incorrect predictions(CodeLlama), whereas debate enhances both consistency and correctness alignment, making LLM reasoning more reliable. This work contributes a method to evaluate LLMs in the absence of ground truth, establishing stability as a metric for assessing model reliability. Applying a multi-agent debate framework offers a promising approach to enhancing LLM reliability, especially in contexts where the ground truth is elusive.","2151-0849","979-8-3315-8503-7","10.1109/ASEW67777.2025.00019","","https://ieeexplore.ieee.org/stamp/stamp.jsp?arnumber=11334553","Large language models;Metamorphic testing;Augmented Reality (AR);Multi-Agent Debate;Stability Evaluation","Software testing;Large language models;Source coding;Predictive models;Stability analysis;Cognition;Software;Software reliability;Augmented reality;Software engineering","","","","48","IEEE","19 Jan 2026","16-20 Nov. 2025","16-20 Nov. 2025","IEEE","IEEE Conferences"
