"Leveraging Large Language Models for Dynamic Scenario Building targeting Enhanced Cyber-threat Detection and Security Training","C. Marantos; S. Evangelatos; E. Veroni; G. Lalas; K. Chasapas; I. T. Christou; P. Lappas","Research & Innovation Development Department, Netcompany-Intrasoft S.A., Luxembourg, Luxembourg; Research & Innovation Development Department, Netcompany-Intrasoft S.A., Luxembourg, Luxembourg; Research & Innovation Development Department, Netcompany-Intrasoft S.A., Luxembourg, Luxembourg; Research & Innovation Development Department, Netcompany-Intrasoft S.A., Luxembourg, Luxembourg; Research & Innovation Development Department, Netcompany-Intrasoft S.A., Luxembourg, Luxembourg; Research & Innovation Development Department, Netcompany-Intrasoft S.A., Luxembourg, Luxembourg; Research & Innovation Development Department, Netcompany-Intrasoft S.A., Luxembourg, Luxembourg",2024 IEEE International Conference on Big Data (BigData),"16 Jan 2025","2024","","","2779","2788","As cybercrime is becoming increasingly sophisticated, effective cybersecurity is crucial to safeguard digital assets and protect critical infrastructures from emerging threats. Several security applications exploit recent advances in (Big) data analysis and Artificial Intelligence (AI) to prevent and respond to malicious activities. Towards this direction, supervised and unsupervised Machine Learning (ML) methods are used to detect anomalies or reveal patterns that may indicate potential threats. However, the successful implementation of these technologies requires security practitioners to undergo specialized training to fully understand and use AI-driven tools and data analytics. On the other hand, AI models themselves are vulnerable to a variety of cyber threats, which can compromise their training data and learning processes. To ensure the safe operation of these systems, especially when deployed in adversarial environments, it is crucial to create novel AI adversarial algorithms and models that are resilient against diverse security threats. This work presents a conceptual framework based on Large Language Models (LLMs) supported by a Multi-Agent layer for training of security practitioners in various advanced technologies and enhance ML models ability to detect and respond to emerging cyber threats effectively.","2573-2978","979-8-3503-6248-0","10.1109/BigData62323.2024.10825681","Horizon Europe; ","https://ieeexplore.ieee.org/stamp/stamp.jsp?arnumber=10825681","Scenario Building;LLM;Adversarial Learning;Data Augmentation;Explainable AI","Training;Explainable AI;Large language models;Buildings;Training data;Transforms;Big Data;Data models;Security;Multi-agent systems","","2","","30","IEEE","16 Jan 2025","15-18 Dec. 2024","15-18 Dec. 2024","IEEE","IEEE Conferences"
"A Fully Automated Agent for End-to-End Code Translation and Validation","E. Erer; A. Bozanta; T. Aytac; A. Basar","Computer Engineering, Bogazici University, Istanbul, Turkey; Management Information Systems, Bogazici University, Istanbul, Turkey; Data Science, AI4U, Istanbul, Turkey; Data Science Lab, Toronto Metropolitan University, Toronto, Canada",2025 ACM/IEEE International Symposium on Empirical Software Engineering and Measurement (ESEM),"12 Jan 2026","2025","","","324","330","Background: Software migration across programming languages is a critical yet labor-intensive task, often requiring deep code understanding and manual intervention. Aims: In this study, we aim to develop a fully automated agent for end-to-end code translation and validation. Method: First, we generate code comments from Java source code using various large language models (LLMs) to enhance code comprehension and facilitate cross-language translation. Second, leveraging these AI-generated comments, we automatically generate equivalent C# code, demonstrating the potential of AI in software migration and interoperability. Third, we complete both Java and generated C# code and prepare them to execute. Fourth, we apply automated unit testing to assess functional correctness and ensure the reliability of AI-generated code. Results: Our results show that a fully automated LLM agent may effectively bridge programming languages with minimal human input. This approach opens new possibilities for scalable, AIdriven software modernization and cross-platform development. Conclusions: We recommend that such an LLM agent should be used to support human experts during the generation of reliable and correct code.","","979-8-3315-9147-2","10.1109/ESEM64174.2025.00058","","https://ieeexplore.ieee.org/stamp/stamp.jsp?arnumber=11323478","code generation;code summarization;code translation;code completion;automated unit testing","Java;Computer languages;Codes;Translation;Source coding;Manuals;Software;C# languages;Software reliability;Testing","","","","25","IEEE","12 Jan 2026","2-3 Oct. 2025","2-3 Oct. 2025","IEEE","IEEE Conferences"
"A Fully Automated Agent for End-to-End Code Translation and Validation","E. Erer; A. Bozanta; T. Aytac; A. Basar","Computer Engineering, Bogazici University, Istanbul, Turkey; Management Information Systems, Bogazici University, Istanbul, Turkey; Data Science, AI4U, Istanbul, Turkey; Data Science Lab, Toronto Metropolitan University, Toronto, Canada",2025 IEEE International Conference on Collaborative Advances in Software and COmputiNg (CASCON),"23 Jan 2026","2025","","","134","141","Migration of software across programming languages is a critical yet labor-intensive task, often requiring deep code understanding and manual intervention. In this study, we develop a fully automated agent for end-to-end code translation and validation. First, we generate code comments from Java source code using various large language models (LLMs) to enhance code comprehension and facilitate cross-language translation. Second, leveraging these AI-generated comments, we automatically generate equivalent C# code, demonstrating the potential of AI in software migration and interoperability. Third, we complete both Java and generated C# code and prepare them to execute. Fourth, we apply automated unit testing to assess functional correctness and ensure the reliability of AI-generated code. Our results show that a fully automated LLM agent may be effective in bridging programming languages with human-in-the-loop. This approach opens new possibilities for scalable, AIdriven software modernization and cross-platform development. We recommend that such an LLM agent should be used in tandem with human experts during the generation of a reliable and correct code.","","979-8-3315-9948-5","10.1109/CASCON66301.2025.00128","","https://ieeexplore.ieee.org/stamp/stamp.jsp?arnumber=11344486","code generation;code summarization;code translation;code completion;automated unit testing","Measurement;Java;Computer languages;Codes;Translation;Source coding;Software;C# languages;Software reliability;Testing","","","","25","IEEE","23 Jan 2026","10-13 Nov. 2025","10-13 Nov. 2025","IEEE","IEEE Conferences"
"Human-In-The-Loop Software Development Agents: Challenges and Future Directions","J. Pasuksmit; W. Takerngsaksiri; P. Thongtanunam; C. Tantithamthavorn; R. Zhang; S. Wang; F. Jiang; J. Li; E. Cook; K. Chen; M. Wu","Atlassian, Australia; Monash University, Australia; The University of Melbourne, Australia; Monash University, Australia; Atlassian, Australia; Atlassian, Australia; Atlassian, Australia; Atlassian, Australia; Atlassian, Australia; Atlassian, Australia; Atlassian, Australia",2025 IEEE/ACM 22nd International Conference on Mining Software Repositories (MSR),"13 Jun 2025","2025","","","756","757","Multi-agent LLM-driven systems for software development are rapidly gaining traction, offering new opportunities to enhance productivity. At Atlassian, we deployed Human-in-the-Loop Software Development Agents to resolve Jira work items and evaluated the generated code quality using functional correctness testing and GPT-based similarity scoring. This paper highlights two major challenges: the high computational costs of unit testing and the variability in LLM-based evaluations. We also propose future research directions to improve evaluation frameworks for Human-In-The-Loop software development tools.","2574-3864","979-8-3315-0183-9","10.1109/MSR66628.2025.00112","","https://ieeexplore.ieee.org/stamp/stamp.jsp?arnumber=11025667","hula;atlassian;llm;human-in-the-loop;jira;code-generation","Productivity;Codes;Human in the loop;Software;Computational efficiency;Data mining;Software development management;Testing","","1","","6","IEEE","13 Jun 2025","28-29 April 2025","28-29 April 2025","IEEE","IEEE Conferences"
"Autonomous Penetration Testing: Solving Capture-the-Flag Challenges with LLMs","I. Bakker; J. Hastings","The Beacom College of Computer and Cyber Sciences, Dakota State University, Madison, SD, USA; The Beacom College of Computer and Cyber Sciences, Dakota State University, Madison, SD, USA",2025 Cyber Awareness and Research Symposium (CARS),"21 Jan 2026","2025","","","1","6","This study evaluates the ability of GPT-4o to au-tonomously solve beginner-level offensive security tasks by con-necting the model to OverTheWire's Bandit capture-the-flag game. Of the 25 levels that were technically compatible with a single-command SSH framework, GPT-4o solved 18 unaided and another two after minimal prompt hints for an overall 80% success rate. The model excelled at single-step challenges that involved Linux filesystem navigation, data extraction or decoding, and straightforward networking. The approach often produced the correct command in one shot and at a human-surpassing speed. Failures involved multi-command scenarios that required persistent working directories, complex network reconnaissance, daemon creation, or interaction with non-standard shells. These limitations largely reflect the architectural harness choices rather than a lack of general exploit knowledge. The results demonstrate that large language models (LLMs) can automate a substantial portion of novice penetration-testing workflow, potentially lowering the expertise barrier for attackers and offering productivity gains for defenders who use LLMs as rapid reconnaissance aides. Further, the unsolved tasks reveal specific areas where secure-by-design environments might frustrate simple LLM -driven attacks, informing future hardening strategies. Beyond offensive cyberse-curity applications, results suggest the potential to integrate LLMs into cybersecurity education as practice aids.","","979-8-3315-9628-6","10.1109/CARS67163.2025.11337515","","https://ieeexplore.ieee.org/stamp/stamp.jsp?arnumber=11337515","Large Language Models (LLMs);Offensive Cy-bersecurity;Capture-the-Flag (CTF) Challenges;Penetration Testing Automation","Productivity;Navigation;Linux;Large language models;Education;Games;Reconnaissance;Data models;Decoding;Penetration testing","","","","20","IEEE","21 Jan 2026","27-30 Oct. 2025","27-30 Oct. 2025","IEEE","IEEE Conferences"
"Seeing is Believing: Vision-Driven Non-Crash Functional Bug Detection for Mobile Apps","Z. Liu; C. Li; C. Chen; J. Wang; M. Chen; B. Wu; Y. Wang; J. Hu; Q. Wang","State Key Laboratory of Complex System Modeling and Simulation Technology, Institute of Software Chinese Academy of Sciences, University of Chinese Academy of Sciences, Beijing, China; State Key Laboratory of Complex System Modeling and Simulation Technology, Institute of Software Chinese Academy of Sciences, University of Chinese Academy of Sciences, Beijing, China; Technical University of Munich, Munich, Germany; State Key Laboratory of Complex System Modeling and Simulation Technology, Institute of Software Chinese Academy of Sciences, University of Chinese Academy of Sciences, Beijing, China; State Key Laboratory of Complex System Modeling and Simulation Technology, Institute of Software Chinese Academy of Sciences, University of Chinese Academy of Sciences, Beijing, China; State Key Laboratory of Complex System Modeling and Simulation Technology, Institute of Software Chinese Academy of Sciences, University of Chinese Academy of Sciences, Beijing, China; State Key Laboratory of Complex System Modeling and Simulation Technology, Institute of Software Chinese Academy of Sciences, University of Chinese Academy of Sciences, Beijing, China; State Key Laboratory of Complex System Modeling and Simulation Technology, Institute of Software Chinese Academy of Sciences, University of Chinese Academy of Sciences, Beijing, China; State Key Laboratory of Complex System Modeling and Simulation Technology, Institute of Software Chinese Academy of Sciences, University of Chinese Academy of Sciences, Beijing, China",IEEE Transactions on Software Engineering,"11 Dec 2025","2025","51","12","3452","3466","Mobile app GUI (Graphical User Interface) pages now contain rich visual information, with the visual semantics of each page helping users understand the application logic. However, these complex visual and functional logics present new challenges to software testing. Existing automated GUI testing methods, constrained by the lack of reliable testing oracles, are limited to detecting crash bugs with obvious abnormal signals. Consequently, many non-crash functional bugs, ranging from unexpected behaviors to logical errors, often evade detection by current techniques. While these non-crash functional bugs can exhibit visual cues that serve as potential testing oracles, they often entail a sequence of screenshots, and detecting them necessitates an understanding of the operational logic among GUI page transitions, which is challenging traditional techniques. Considering the remarkable performance of Multimodal Large Language Models (MLLM) in visual and language understanding, this paper proposes VisionDroid, a novel vision-driven, multi-agent collaborative automated GUI testing approach for detecting non-crash functional bugs. It comprises three agents: Explorer, Monitor, and Detector, to guide the exploration, oversee the testing progress, and spot issues. We also address several challenges, i.e., aligning visual and textual information for MLLM input, achieving functionality-oriented exploration, and inferring test oracles for non-crash bugs, to enhance the performance of functionality bug detection. We evaluate VisionDroid on 590 non-crash bugs and compare it with 12 baselines, it can achieve more than 14%-112% and 108%-147% boost in average recall and precision compared with the best baseline. The ablation study further proves the contribution of each module. Moreover, VisionDroid identifies 43 unknown bugs on Google Play, of which 31 have been fixed.","1939-3520","","10.1109/TSE.2025.3614469","National Natural Science Foundation of China(grant numbers:62402483,62232016,62072442,62272445,62402484); Basic Research Program of ISCAS(grant numbers:ISCAS-JCZD-202304); Major Program of ISCAS(grant numbers:ISCAS-ZD-202302,ISCAS-ZD-202401); Innovation Team 2024 ISCAS(grant numbers:2024-66); ","https://ieeexplore.ieee.org/stamp/stamp.jsp?arnumber=11181197","Multimodal large language model;android app;non-crash bugs","Computer bugs;Graphical user interfaces;Testing;Visualization;Detectors;Monitoring;Logic;Data mining;Semantics;Annotations","","","","66","IEEE","26 Sep 2025","Dec. 2025","","IEEE","IEEE Journals"
"ChipMnd: LLMs for Agile Chip Design","F. Firouzi; D. Z. Pan; J. Gu; B. Farahani; J. Chaudhuri; Z. Yin; P. Ma; P. Domanski; K. Chakrabarty",Arizona State University; University of Texas at Austin; Arizona State University; Shahid Beheshti University; Arizona State University; Arizona State University; Arizona State University; Arizona State University; Arizona State University,2025 IEEE 43rd VLSI Test Symposium (VTS),"10 Jun 2025","2025","","","1","10","The increasing complexity of semiconductor design, along with stringent performance, power, and time-to-market requirements, has outpaced the capabilities of traditional Electronic Design Automation (EDA) methodologies. Conventional design workflows rely on manual intervention for critical tasks such as hardware description, synthesis optimization, and verification, leading to inefficiencies and scalability limitations. Large Language Models (LLMs) present a transformative approach by automating key stages of the design pipeline, enabling intelligent synthesis tuning, test generation, and security analysis. This paper introduces ChipMind, an LLM-driven framework comprising specialized agents and modules for digital and analog chip design. ChipMind integrates AI-driven methodologies to enhance design efficiency, accelerate prototyping, and optimize key design trade-offs, thereby addressing fundamental challenges in modern semiconductor development.","2375-1053","979-8-3315-2144-8","10.1109/VTS65138.2025.11022936","","https://ieeexplore.ieee.org/stamp/stamp.jsp?arnumber=11022936","AI for chip design;Large Language Models (LLMs);Electronic Design Automation (EDA);hardware security","Design automation;Design methodology;Scalability;Large language models;Hardware security;Very large scale integration;Complexity theory;Test pattern generators;Chip scale packaging;Optimization","","3","","56","IEEE","10 Jun 2025","28-30 April 2025","28-30 April 2025","IEEE","IEEE Conferences"
"Research on Multi-Model Fusion Machine Learning Demand Intelligent Forecasting System in Cloud Computing Environment","J. Huang","EC2 Core Platform, Amazon.Com Services LLC, Seattle, United States",2025 2nd International Conference on Intelligent Algorithms for Computational Intelligence Systems (IACIS),"5 Nov 2025","2025","","","1","7","Background: Large language models (LLMs) are increasingly being used for automated unit test generation, but reported performance varies across tasks and datasets, and key aspects such as assertion plausibility and target coverage are not well understood. Methods: We perform a structured evaluation of LLM-based test generation on recent benchmarks and settings, summarizing research results in hinting, static analysis guidance, multi-agent work frameworks, and oracle generation; we compare LLMs with traditional tools such as EvoSuite, and analyze factors that affect coverage, fault detection, and maintainability. Results: When LLMs are used in conjunction with static analysis or method slicing, competitive and improved coverage can be achieved; achieving target line/branch/path coverage and obtaining robust oracles remain challenging; using multi-stage hints and tools (e.g., interpreters/RAGs) can enhance the correctness of results, and manually verified benchmarks can effectively improve the reliability of evaluations. The tests generated by LLM are promising but not uniformly so: future extensions depend on better oracle reasoning, task-appropriate prompts and scaffolding, and rigorous contamination-aware evaluation with statistical tests and repeatable properties.","","979-8-3315-3677-0","10.1109/IACIS65746.2025.11210946","","https://ieeexplore.ieee.org/stamp/stamp.jsp?arnumber=11210946","cloud computing;resource demand forecasting;ensemble learning;machine learning","Cloud computing;Machine learning algorithms;Computational modeling;Stacking;Demand forecasting;Static analysis;Benchmark testing;Predictive models;Test pattern generators;Reliability","","","","12","IEEE","5 Nov 2025","22-23 Aug. 2025","22-23 Aug. 2025","IEEE","IEEE Conferences"
